{
  "$schema": "https://json-schema.org/draft/2020-12/schema",
  "$id": "https://github.com/Wasif-ZA/DynamicSolver/contract/packing-request.schema.json",
  "title": "Packing request",
  "description": "An order to be packed: the box types available, the items to ship, and the rules that constrain how they may be combined. All lengths are integer millimetres, all weights integer grams.",
  "type": "object",
  "required": ["requestId", "boxes", "items"],
  "additionalProperties": false,
  "properties": {
    "requestId": {
      "type": "string",
      "minLength": 1,
      "description": "Caller's identifier for this order. Echoed back unchanged so logs on both sides can be correlated."
    },
    "mode": {
      "enum": ["standard", "fluid", "own_packaging"],
      "default": "standard",
      "description": "standard packs by real geometry. fluid ignores geometry and packs by total volume, for liquids and squishable apparel. own_packaging skips boxing for items that ship in their own carton. Only standard is implemented."
    },
    "boxes": {
      "type": "array",
      "minItems": 1,
      "description": "Box TYPES the warehouse stocks, not physical boxes. The solver may use a type many times.",
      "items": { "$ref": "#/$defs/boxType" }
    },
    "items": {
      "type": "array",
      "minItems": 1,
      "description": "Order lines. One entry may represent several identical units via quantity.",
      "items": { "$ref": "#/$defs/itemLine" }
    },
    "rules": { "$ref": "#/$defs/rules" }
  },
  "$defs": {
    "dimensions": {
      "type": "object",
      "required": ["width", "height", "depth"],
      "additionalProperties": false,
      "description": "Integer millimetres. width is x, height is y (up), depth is z.",
      "properties": {
        "width": { "type": "integer", "exclusiveMinimum": 0 },
        "height": { "type": "integer", "exclusiveMinimum": 0 },
        "depth": { "type": "integer", "exclusiveMinimum": 0 }
      }
    },
    "boxType": {
      "type": "object",
      "required": ["id", "interior"],
      "additionalProperties": false,
      "properties": {
        "id": {
          "type": "string",
          "minLength": 1,
          "description": "Unique among boxes in this request."
        },
        "name": {
          "type": "string",
          "description": "Human label, for the visualiser and for pickers. Not used by the solver."
        },
        "interior": {
          "$ref": "#/$defs/dimensions",
          "description": "Usable space INSIDE the box, wall thickness already excluded."
        },
        "maxWeight": {
          "type": "integer",
          "exclusiveMinimum": 0,
          "description": "Gross limit in grams, including tareWeight. Omit for no limit. Modelled but not enforced: the client is not hitting this yet."
        },
        "tareWeight": {
          "type": "integer",
          "minimum": 0,
          "default": 0,
          "description": "Weight of the empty box in grams. Counts toward maxWeight."
        },
        "available": {
          "type": ["integer", "null"],
          "minimum": 0,
          "default": null,
          "description": "How many of this type are on hand. null means effectively unlimited, which is the normal case."
        }
      }
    },
    "itemLine": {
      "type": "object",
      "required": ["id", "size"],
      "additionalProperties": false,
      "properties": {
        "id": {
          "type": "string",
          "minLength": 1,
          "description": "Unique among items in this request. Identifies the LINE; individual units are addressed by id plus unit index in the response."
        },
        "reference": {
          "type": "string",
          "description": "The warehouse's own SKU or product code. Passed through untouched for display and scanning."
        },
        "name": { "type": "string", "description": "Human label for the visualiser." },
        "size": { "$ref": "#/$defs/dimensions" },
        "weight": {
          "type": "integer",
          "minimum": 0,
          "default": 0,
          "description": "Grams, per unit, not per line."
        },
        "quantity": {
          "type": "integer",
          "exclusiveMinimum": 0,
          "default": 1,
          "description": "How many identical units this line represents."
        },
        "groups": {
          "type": "array",
          "default": [],
          "uniqueItems": true,
          "items": { "type": "string", "minLength": 1 },
          "description": "Free-text tags this item belongs to, for example DG-3 or keyboards. Rules are expressed over these, never over item ids."
        }
      }
    },
    "rules": {
      "type": "object",
      "additionalProperties": false,
      "description": "Constraints on how items may be combined. Absent means no constraints.",
      "properties": {
        "incompatibleGroups": {
          "type": "array",
          "default": [],
          "description": "Each entry is a set of groups where no two members may share a box. The legal driver is dangerous goods classes, but the mechanism is deliberately generic.",
          "items": {
            "type": "array",
            "minItems": 2,
            "uniqueItems": true,
            "items": { "type": "string", "minLength": 1 }
          }
        },
        "keepTogether": {
          "type": "array",
          "default": [],
          "description": "Each entry is a group whose members should share a box where possible. A preference, not a hard constraint: the solver will break it rather than fail the order.",
          "items": { "type": "string", "minLength": 1 }
        }
      }
    }
  }
}
