{
  "requestId": "ord-10433",
  "mode": "standard",
  "boxes": [
    {
      "id": "B-SMALL",
      "name": "Small carton",
      "interior": { "width": 300, "height": 200, "depth": 150 },
      "maxWeight": 15000,
      "tareWeight": 250,
      "available": null
    }
  ],
  "items": [
    {
      "id": "I-BLEACH",
      "reference": "SKU-CLEAN-08",
      "name": "Bleach concentrate 1L",
      "size": { "width": 100, "height": 100, "depth": 200 },
      "weight": 1200,
      "quantity": 1,
      "groups": ["DG-8"]
    },
    {
      "id": "I-PEROXIDE",
      "reference": "SKU-CLEAN-05",
      "name": "Peroxide solution 1L",
      "size": { "width": 100, "height": 100, "depth": 200 },
      "weight": 1100,
      "quantity": 1,
      "groups": ["DG-5"]
    }
  ],
  "rules": {
    "incompatibleGroups": [["DG-5", "DG-8"]]
  }
}
