{
  "requestId": "ord-10432",
  "mode": "standard",
  "boxes": [
    {
      "id": "B-SMALL",
      "name": "Small carton",
      "interior": { "width": 300, "height": 200, "depth": 150 },
      "maxWeight": 15000,
      "tareWeight": 250,
      "available": null
    }
  ],
  "items": [
    {
      "id": "I-BOOK",
      "reference": "SKU-BOOK-01",
      "name": "Paperback",
      "size": { "width": 150, "height": 100, "depth": 50 },
      "weight": 400,
      "quantity": 2
    },
    {
      "id": "I-MUG",
      "reference": "SKU-MUG-01",
      "name": "Ceramic mug, boxed",
      "size": { "width": 100, "height": 100, "depth": 120 },
      "weight": 350,
      "quantity": 1
    }
  ]
}
